{
    "alert_id": "ALT-A9C3F21D",
    "timestamp": "2026-01-09T11:12:44Z",
    "source": {
        "system_name": "CrowdStrike-EDR",
        "system_type": "EDR",
        "system_id": "edr-sensor-22"
    },
    "severity": "critical",
    "alert_type": "malware_detection",
    "description": "Suspicious PowerShell execution detected with encoded command",
    "affected_assets": [
        {
            "asset_type": "host",
            "asset_id": "finance-ws-07",
            "asset_details": {
                "hostname": "finance-ws-07.corp.local",
                "ip": "10.0.8.41",
                "os": "Windows 11"
            }
        }
    ],
    "indicators": {
        "processes": [
            "powershell.exe"
        ],
        "file_hashes": {
            "sha256": [
                "e3b0c44298fc1c149afbf4c8996fb92427ae41e4649b934ca495991b7852b855"
            ]
        }
    },
    "context": {
        "attack_phase": "installation",
        "mitre_tactics": [
            "TA0002 - Execution"
        ],
        "mitre_techniques": [
            "T1059.001 - PowerShell"
        ],
        "confidence_score": 0.94,
        "false_positive_likelihood": "low"
    },
    "metrics": {
        "event_count": 3
    },
    "tags": [
        "endpoint",
        "powershell",
        "finance"
    ],
    "metadata": {
        "business_unit": "Finance",
        "asset_criticality": "high"
    }
}